{
  "source_id": "btb:llm:example-source",
  "origin": "original-authored",
  "revision": "SOURCE_REVISION_TO_BE_VERIFIED",
  "source_uri": "content/lessons/10-native-ai/93-check-real-tape-evidence.md",
  "creator": "Sammy Hegab / Umicom Foundation",
  "licence": "TO_BE_REVIEWED",
  "classification": "public",
  "publication_permission": "not_assessed",
  "training_permission": "not_assessed",
  "review_status": "pending_review",
  "evaluation_partition": "unassigned",
  "notes": "Illustrative governance record; NOT approved for training or release."
}
